{
  "version": "1.0",
  "environments": {
    "googleWorkspace": {
      "enabled": true,
      "audit": {
        "enabled": true,
        "targetOU": "/",
        "categories": {
          "authentication": true,
          "emailSecurity": true,
          "driveSecurity": true,
          "oauthSecurity": true,
          "adminManagement": true,
          "collaboration": true,
          "deviceManagement": true,
          "loggingAlerting": true
        }
      }
    },
    "activeDirectory": {
      "enabled": true,
      "audit": {
        "enabled": true,
        "categories": {
          "domainForest": true,
          "trusts": true,
          "privilegedAccounts": true,
          "passwordPolicy": true,
          "kerberos": true,
          "aclDelegation": true,
          "groupPolicy": true,
          "logonScripts": true,
          "certificateServices": true,
          "staleObjects": true
        }
      }
    },
    "entraAzure": {
      "enabled": true,
      "audit": {
        "enabled": true,
        "categories": {
          "conditionalAccess": true,
          "authenticationMethods": true,
          "pim": true,
          "applications": true,
          "federation": true,
          "tenantConfig": true,
          "azureIAM": true
        }
      }
    },
    "m365": {
      "enabled": true,
      "audit": {
        "enabled": true,
        "categories": {
          "m365Services": true
        }
      }
    },
    "intune": {
      "enabled": true,
      "audit": {
        "enabled": true,
        "categories": {
          "intune": true
        }
      }
    }
  },
  "reporting": {
    "formats": [
      "html",
      "csv",
      "json"
    ],
    "sections": {
      "executiveSummary": true,
      "technicalDetail": true,
      "remediationPlaybook": true,
      "remediationScripts": true,
      "deltaReport": true,
      "quickWins": true,
      "budgetJustification": false,
      "threatActorProfiles": false
    },
    "frameworks": {
      "nist800171": true,
      "cisBenchmarks": true,
      "mitreAttack": true,
      "anssi": false,
      "ferpa": true,
      "coppa": true,
      "cipa": true,
      "stateEdtech": true,
      "stateRequirements": {
        "enabled": false,
        "states": []
      }
    }
  },
  "credentials": {
    "strategy": "secretManagement",
    "vaultName": "Guerrilla",
    "references": {
      "googleWorkspace": {
        "type": "serviceAccount",
        "vaultKey": "GUERRILLA_GWS_SA",
        "scopes": [
          "https://www.googleapis.com/auth/admin.directory.user.readonly",
          "https://www.googleapis.com/auth/admin.directory.domain.readonly",
          "https://www.googleapis.com/auth/admin.directory.device.mobile.readonly",
          "https://www.googleapis.com/auth/admin.directory.orgunit.readonly",
          "https://www.googleapis.com/auth/apps.alerts",
          "https://www.googleapis.com/auth/admin.reports.audit.readonly"
        ]
      },
      "microsoftGraph": {
        "type": "appRegistration",
        "vaultKey": "GUERRILLA_GRAPH_SECRET",
        "tenantIdVaultKey": "GUERRILLA_GRAPH_TENANT",
        "clientIdVaultKey": "GUERRILLA_GRAPH_CLIENTID",
        "authMethod": "clientSecret"
      },
      "activeDirectory": {
        "type": "currentUser",
        "authMethod": "kerberos"
      }
    }
  }
}
